"EA-Type"	"EA-Package"	"EA-Name"	"EA-GUID"	"EA-Parent"	"EA-Domain"	"EA-Domain-GUID"	"EA-Range"	"ap-label-nl"	"ap-definition-nl"	"ap-usageNote-nl"	"ap-codelist"	"external term"	"namespace"	"localname"	"type"	"domain"	"range"	"parent"	"min card"	"max card"
"Package"	""	"OSLO²_applicatieprofiel_Dienst_transactiemodel"	"{E44145AF-5A8F-420d-B282-24596F2BAB1E}"	""	""	""	""	""	""	""	""	""	"http://data.vlaanderen.be/ns/"	"dienst"	"http://www.w3.org/2002/07/owl#Ontology"	""	""	""	""	""
"CLASS"	"OSLO²_applicatieprofiel_Dienst_transactiemodel"	"Participatie"	"{373D5ACA-EAB3-46b1-A8CF-69F77F173910}"	""	""	""	""	"Participatie"	"Deelname aan een publieke dienstverlening door een agent."	"Aanvullend op de standaard associatie van een publieke dienstverlening met de uitvoerder of de bevoegde instantie van een publieke dienstverlening biedt participatie de mogelijkheid om deze of andere relaties gedetailleerder te beschrijven. Bv start- en einddatum van een contract, meerdere rollen voor eenzelfde participatie (bv de dienstverlener is tegelijk ook de bevoegde instantie)."	""	"true"	"http://data.europa.eu/m8g/"	"Participation"	"http://www.w3.org/2000/01/rdf-schema#Class"	""	""	""	""	""
"DATATYPE"	"OSLO²_applicatieprofiel_Dienst_transactiemodel"	"Kost"	"{95835542-7C29-4f9a-AE1D-0709D6F2FF96}"	""	""	""	""	"Kost"	"Deel vd kost verbonden aan de uitvoering van de dienstverlening te betalen door de gebruiker."	" "	""	"true"	"http://data.europa.eu/m8g/"	"Cost"	"http://www.w3.org/2000/01/rdf-schema#Class"	""	""	""	""	""
"DATATYPE"	"OSLO²_applicatieprofiel_Dienst_transactiemodel"	"Adresvoorstelling"	"{6E4F176A-F628-4254-9EB0-BFC0DF707CCB}"	""	""	""	""	"Adresvoorstelling"	"Meer leesbare voorstelling met enkel de basisgegevens van het adres, bedoeld voor het gebruik van een adres als attribuut van een ander object."	"Bv als attribuut ve persoon of gebouw De adresvoorstelling heeft niet enkel betrekking op Belgische adressen, ze kan gebruikt worden om buitenlandse adressen weer te geven (waar mogelijk andere adresaanduidingen dan huisnummer of busnummer worden gebruikt of waar adrescomponenten zoals adresgebieden voorkomen)."	""	"true"	"http://www.w3.org/ns/locn#"	"Address"	"http://www.w3.org/2000/01/rdf-schema#Class"	""	""	""	""	""
"DATATYPE"	"OSLO²_applicatieprofiel_Dienst_transactiemodel"	"ContactInfo"	"{EE4CD626-03C4-4ff7-AD24-2C0FC8E5A631}"	""	""	""	""	"Contactpunt"	"Informatie zoals email, telefoon, adres die toelaat om iemand of iets te contacteren."	"Bvb een persoon of organisatie of dienstverlening Mogelijke vormen van contact: bellen, mailen etc."	""	"true"	"http://schema.org/"	"ContactPoint"	"http://www.w3.org/2000/01/rdf-schema#Class"	""	""	""	""	""
"DATATYPE"	"OSLO²_applicatieprofiel_Dienst_transactiemodel"	"Status"	"{7A2485BA-C313-4925-A739-3B8FCE7ABE44}"	""	""	""	""	"Status"	"De status van het dossier."	""	""	"false"	"http://data.vlaanderen.be/ns/dienst#"	"Status"	"http://www.w3.org/2000/01/rdf-schema#Class"	""	""	""	""	""
"CLASS"	"OSLO²_applicatieprofiel_Dienst_transactiemodel"	"Agent"	"{F313B529-7008-475a-986F-86C2F195A2D8}"	""	""	""	""	""	"Een resource die handelingen kan stellen. Voorbeelden van Agent zijn: persoon, organisatie, publieke organisatie en hoedanigheid."	""	""	"true"	"http://purl.org/dc/terms/"	"Agent"	"http://www.w3.org/2000/01/rdf-schema#Class"	""	""	""	""	""
"CLASS"	"OSLO²_applicatieprofiel_Dienst_transactiemodel"	"Kanaal"	"{AB998D53-835F-4e60-8A8A-C80A6E6BDA65}"	""	""	""	""	"kanaal"	"Kanaal waarlangs een Agent kan interageren met de Publieke Dienstverlening."	"Typische voorbeelden: online, telefoon, kantoor"	""	"true"	"http://data.europa.eu/m8g/"	"Channel"	"http://www.w3.org/2000/01/rdf-schema#Class"	""	""	""	""	""
"CLASS"	"OSLO²_applicatieprofiel_Dienst_transactiemodel"	"Bewijs"	"{0999B773-85DC-4682-A9D1-05E78559DF24}"	""	""	""	""	"Bewijs"	"Elk stuk waarmee kan worden aangetoond dat men aan een CriteriumVereiste voldoet."	"In het kader van publieke dienstverlening gaat het meestal om administratieve documenten of ingevulde aanvraagformulieren. Zonder het nodige Bewijs kan de dienstverlening niet worden afgeleverd. Soms levert de Output van een Publieke Dienstverlening het Bewijs nodig voor een andere Publieke Dienstverlening."	""	"true"	"http://data.europa.eu/m8g/"	"Evidence"	"http://www.w3.org/2000/01/rdf-schema#Class"	""	""	""	""	""
"CLASS"	"OSLO²_applicatieprofiel_Dienst_transactiemodel"	"Output"	"{82D27B78-9267-4c0c-8D46-C9610228CEF4}"	""	""	""	""	"Output"	"Resultaat van een Publieke Dienstverlening. Officieel document of ander artefact van de bevoegde instantie (Publieke Organisatie) dat een Agent "	"Bv toelating verstrekt door of in naam van de bevoegde instantie (Publieke Organisatie) dat een Agent  toelaat om iets bepaald te ondernemen. Eventueel vormt deze Output het noodzakelijk Bewijs, voor te leggen om gebruik te kunnen maken van een Andere Dienstverlening. Dit kan verder gedocumenteerd worden in de Richtlijn geassocieerd met de Publieke Dienstverlening."	""	"true"	"http://data.europa.eu/m8g/"	"Output"	"http://www.w3.org/2000/01/rdf-schema#Class"	""	""	""	""	""
"CLASS"	"OSLO²_applicatieprofiel_Dienst_transactiemodel"	"PubliekeDienstverlening"	"{5A9EFFF9-4053-471f-9BF2-89EAAF400E7D}"	""	""	""	""	"Publieke Dienstverlening"	"Een Publieke Dienstverlening is een geheel van verplichte of optioneel uitgevoerde of uitvoerbare acties door of in naam van een publieke organisatie. De dienstverlening is ten bate van een individu, een bedrijf, een andere publieke organisatie of groepen hiervan."	"De dienstverlening vormt een aanbod (dat dus niet noodzakelijk wordt gebruikt). Ze houdt niet noodzakelijk het opnemen van een recht in, de dienstverlening kan de gebruiker ook toelaten een verplichting te vervullen."	""	"true"	"http://purl.org/vocab/cpsv#"	"PublicService"	"http://www.w3.org/2000/01/rdf-schema#Class"	""	""	""	""	""
"connector"	""	"vereistAlsInput"	"{0A9DE35B-2CF3-4bb8-A0ED-7049D644FFE0}"	""	"PubliekeDienstverlening"	"{5A9EFFF9-4053-471f-9BF2-89EAAF400E7D}"	"Bewijs"	"heeft input"	"Bewijsstuk dat moeten voorgelegd worden om de Publieke Dienstverlening te kunnen gebruiken."	"Als de bewijsstukken afhangen het kanaal waarmee met de Publieke Dienstverlening wordt geïnterageerd gebruiken we de associatie Kanaal-vereistAlsInput-Bewijs."	""	"true"	"http://purl.org/vocab/cpsv#"	"hasInput"	"http://www.w3.org/2002/07/owl#ObjectProperty"	"http://purl.org/vocab/cpsv#PublicService"	"http://data.europa.eu/m8g/Evidence"	""	"0"	"*"
"connector"	""	"produceert"	"{82D61234-0721-4669-8855-114800D2995C}"	""	"PubliekeDienstverlening"	"{5A9EFFF9-4053-471f-9BF2-89EAAF400E7D}"	"Output"	"produceert"	"Het werkelijke resultaat van de uitvoering vd Publieke Dienstverlening."	"Bvb een erkenning, financieel voordeel, code, fysiek object"	""	"true"	"http://purl.org/vocab/cpsv#"	"produces"	"http://www.w3.org/2002/07/owl#ObjectProperty"	"http://purl.org/vocab/cpsv#PublicService"	"http://data.europa.eu/m8g/Output"	""	"0"	"*"
"connector"	""	"heeftParticiperende"	"{62B409A2-D459-408e-999F-B2F67BD5B977}"	""	"PubliekeDienstverlening"	"{5A9EFFF9-4053-471f-9BF2-89EAAF400E7D}"	"Participatie"	"heeft participatie"	"Participatie (van een agent) aan de publieke dienstverlening."	"De manier waarop de agent participeert wordt beschreven door de entiteit Participatie. Laat oa toe om de bestaande associaties PubliekeDienstverlening-wordtUitgevoerdDoor-Agent en PubliekeDienstverlening-heeftVerantwoordelijke-PubliekeOrganisatie meer in detail te beschrijven."	""	"true"	"http://data.europa.eu/m8g/"	"hasParticipation"	"http://www.w3.org/2002/07/owl#ObjectProperty"	"http://purl.org/vocab/cpsv#PublicService"	"http://data.europa.eu/m8g/Participation"	""	""	""
"connector"	""	"heeftParticiperende"	"{62B409A2-D459-408e-999F-B2F67BD5B977}"	""	"Agent"	"{F313B529-7008-475a-986F-86C2F195A2D8}"	"Participatie"	"speelt rol"	"Participatie van de agent (aan een publieke dienstverlening)."	"De manier waarop de agent participeert wordt beschreven door de entiteit Participatie. Laat oa toe om de bestaande associaties PubliekeDienstverlening-wordtUitgevoerdDoor-Agent en PubliekeDienstverlening-heeftVerantwoordelijke-PubliekeOrganisatie meer in detail te beschrijven."	""	"true"	"http://data.europa.eu/m8g/"	"playsRole"	"http://www.w3.org/2002/07/owl#ObjectProperty"	"http://purl.org/dc/terms/Agent"	"http://data.europa.eu/m8g/Participation"	""	""	""
"connector"	""	"teConsumerenVia"	"{48891FC1-89DB-4ca9-8B1E-B9449A793CF6}"	""	"PubliekeDienstverlening"	"{5A9EFFF9-4053-471f-9BF2-89EAAF400E7D}"	"Kanaal"	"heeft kanaal"	"Kanaal waarlangs een Agent interageert met een Publieke Dienstverlening."	"Bv kantoor, telefoon, website"	""	"true"	"http://data.europa.eu/m8g/"	"hasChannel"	"http://www.w3.org/2002/07/owl#ObjectProperty"	"http://purl.org/vocab/cpsv#PublicService"	"http://data.europa.eu/m8g/Channel"	""	"0"	"*"
"connector"	""	"heeftStatus"	"{6F092903-B92F-4370-9E6A-2421FB1B9C08}"	""	"PubliekeDienstverlening"	"{5A9EFFF9-4053-471f-9BF2-89EAAF400E7D}"	"Status"	"heeft status"	"Link tussen Publieke Dienstverlening en Status."	""	""	"true"	"http://data.vlaanderen.be/ns/dienst#"	"heeftStatus"	"http://www.w3.org/2002/07/owl#ObjectProperty"	"http://purl.org/vocab/cpsv#PublicService"	"http://data.vlaanderen.be/ns/dienst#Status"	""	"0"	"*"
"connector"	""	"wordtUitgevoerdDoor"	"{B25F0901-44B5-4ba2-846D-FBF0B3DFF124}"	""	"PubliekeDienstverlening"	"{5A9EFFF9-4053-471f-9BF2-89EAAF400E7D}"	"Agent"	"dienstverlener"	"Agent die de Publieke Dienstverlening verstrekt."	"Staat los van de rol die de bevoegde instantie speelt, kan een externe aannemer zijn."	""	"true"	"http://data.europa.eu/m8g/"	"serviceProvider"	"http://www.w3.org/2002/07/owl#ObjectProperty"	"http://purl.org/vocab/cpsv#PublicService"	"http://purl.org/dc/terms/Agent"	""	"0"	"*"
"connector"	""	"isGerelateerdMet"	"{6F305160-B3C7-4d09-8585-40890F261C61}"	""	"PubliekeDienstverlening"	"{5A9EFFF9-4053-471f-9BF2-89EAAF400E7D}"	"PubliekeDienstverlening"	"is gerelateerd met"	"Andere Publieke Dienstverlening waarmee de Publieke Dienstverlening gerelateerd is."	""	""	"true"	"http://purl.org/dc/terms/"	"relation"	"http://www.w3.org/2002/07/owl#ObjectProperty"	"http://purl.org/vocab/cpsv#PublicService"	"http://purl.org/vocab/cpsv#PublicService"	""	"0"	"*"
"attribute"	"OSLO²_applicatieprofiel_Dienst_transactiemodel"	"beschrijving"	"{92077CE1-AE28-4e73-AB18-7EE0DA77227A}"	""	"Participatie"	"{373D5ACA-EAB3-46b1-A8CF-69F77F173910}"	"TaalString"	"beschrijving"	"Beschrijving van de participatie."	" "	""	"true"	"http://purl.org/dc/terms/"	"description"	"http://www.w3.org/1999/02/22-rdf-syntax-ns#Property"	"http://data.europa.eu/m8g/Participation"	""	""	"1"	"1"
"attribute"	"OSLO²_applicatieprofiel_Dienst_transactiemodel"	"rol"	"{80840BF1-F515-4bd5-970B-61EB236B3297}"	""	"Participatie"	"{373D5ACA-EAB3-46b1-A8CF-69F77F173910}"	"ParticipatieRol"	"rol"	"De rol die de participant speelt."	" "	""	"true"	"http://data.europa.eu/m8g/"	"role"	"http://www.w3.org/1999/02/22-rdf-syntax-ns#Property"	"http://data.europa.eu/m8g/Participation"	""	""	"1"	"*"
"attribute"	"OSLO²_applicatieprofiel_Dienst_transactiemodel"	"beschrijving"	"{E90FF289-C8E9-42f0-A3C3-9C2977FC0C94}"	""	"Kost"	"{95835542-7C29-4f9a-AE1D-0709D6F2FF96}"	"String"	"beschrijving"	"Beschrijving van de kost."	" "	""	"true"	"http://purl.org/dc/terms/"	"description"	"http://www.w3.org/2002/07/owl#DatatypeProperty"	"http://data.europa.eu/m8g/Cost"	"http://www.w3.org/2001/XMLSchema#string"	""	"0"	"1"
"attribute"	"OSLO²_applicatieprofiel_Dienst_transactiemodel"	"valuta"	"{77E6D7AE-BF2D-494b-A45C-6EA959B4D150}"	""	"Kost"	"{95835542-7C29-4f9a-AE1D-0709D6F2FF96}"	"NAL_currency"	"valuta"	"Munteenheid waarin de kost is gedefinieerd."	" "	""	"true"	"http://data.europa.eu/m8g/"	"currency"	"http://www.w3.org/1999/02/22-rdf-syntax-ns#Property"	"http://data.europa.eu/m8g/Cost"	""	""	"0"	"1"
"attribute"	"OSLO²_applicatieprofiel_Dienst_transactiemodel"	"waarde"	"{7BA75BF0-B82D-48cc-9769-2157932DAF1D}"	""	"Kost"	"{95835542-7C29-4f9a-AE1D-0709D6F2FF96}"	"Double"	"waarde"	"Omvang van de kost, uitgedrukt in de opgegeven munteenheid."	" "	""	"true"	"http://data.europa.eu/m8g/"	"value"	"http://www.w3.org/2002/07/owl#DatatypeProperty"	"http://data.europa.eu/m8g/Cost"	"http://www.w3.org/2001/XMLSchema#double"	""	"0"	"1"
"attribute"	"OSLO²_applicatieprofiel_Dienst_transactiemodel"	"administratieveEenheidNiveau1"	"{7246DF86-6B2B-41b2-B794-A2619FB89BF4}"	""	"Adresvoorstelling"	"{6E4F176A-F628-4254-9EB0-BFC0DF707CCB}"	"Taalstring"	"administratieve eenheid niveau 1"	"Hoogste Administratieve eenheid vh adres, doorgaans een land."	" "	""	"true"	"http://www.w3.org/ns/locn#"	"adminUnitL1"	"http://www.w3.org/1999/02/22-rdf-syntax-ns#Property"	"http://www.w3.org/ns/locn#Address"	""	""	"0"	"1"
"attribute"	"OSLO²_applicatieprofiel_Dienst_transactiemodel"	"administratieveEenheidNiveau2"	"{CD79EAC9-DB5B-4423-AB23-626CE7877476}"	""	"Adresvoorstelling"	"{6E4F176A-F628-4254-9EB0-BFC0DF707CCB}"	"Taalstring"	"administratieve eenheid niveau 2"	"De regio vh adres, doorgaans een provincie of deelstaat of gelijkaardig gebied dat typisch meerdere plaatsen omvat."	" "	""	"true"	"http://www.w3.org/ns/locn#"	"adminUnitL2"	"http://www.w3.org/1999/02/22-rdf-syntax-ns#Property"	"http://www.w3.org/ns/locn#Address"	""	""	"0"	"1"
"attribute"	"OSLO²_applicatieprofiel_Dienst_transactiemodel"	"adresgebied"	"{77BB29FE-4A82-4d7a-988D-23F4DC99C023}"	""	"Adresvoorstelling"	"{6E4F176A-F628-4254-9EB0-BFC0DF707CCB}"	"Taalstring"	"adresgebied"	"Naam ve geografisch gebied of plaats die een aantal adresseerbare objecten groepeert om deze te adresseren zonder dat het gebied of de plaats een administratieve eenheid is"	"Bvb de naam vh gehucht waarin het adres ligt."	""	"true"	"http://www.w3.org/ns/locn#"	"addressArea"	"http://www.w3.org/1999/02/22-rdf-syntax-ns#Property"	"http://www.w3.org/ns/locn#Address"	""	""	"0"	"1"
"attribute"	"OSLO²_applicatieprofiel_Dienst_transactiemodel"	"busnummer"	"{B4421DEF-A545-4f8b-BA0C-527C23014059}"	""	"Adresvoorstelling"	"{6E4F176A-F628-4254-9EB0-BFC0DF707CCB}"	"String"	"busnummer"	"Officieel toegekende alfanumerieke code die wordt toegevoegd aan het huisnummer om meerdere gebouweenheden, standplaatsen, ligplaatsen of percelen te onderscheiden die eenzelfde huisnummer hebben."	"Specialisatie van Adresvoorstelling:locatieaanduiding tbv Belgische adressen."	""	"false"	"http://data.vlaanderen.be/ns/dienst#"	"Adresvoorstelling.busnummer"	"http://www.w3.org/2002/07/owl#DatatypeProperty"	"http://www.w3.org/ns/locn#Address"	"http://www.w3.org/2001/XMLSchema#string"	"http://www.w3.org/ns/locn#locatorDesignator"	"0"	"1"
"attribute"	"OSLO²_applicatieprofiel_Dienst_transactiemodel"	"gemeentenaam"	"{629B2EC3-F6E7-48bd-A5E3-3FEE65DE4A50}"	""	"Adresvoorstelling"	"{6E4F176A-F628-4254-9EB0-BFC0DF707CCB}"	"Taalstring"	"gemeentenaam"	"Gemeentenaam vh adres."	" "	""	"false"	"http://data.vlaanderen.be/ns/dienst#"	"gemeentenaam"	"http://www.w3.org/1999/02/22-rdf-syntax-ns#Property"	"http://www.w3.org/ns/locn#Address"	""	"http://www.w3.org/ns/locn#postName"	"0"	"1"
"attribute"	"OSLO²_applicatieprofiel_Dienst_transactiemodel"	"huisnummer"	"{EF60F30F-3349-4a22-B517-24EAC5B812AD}"	""	"Adresvoorstelling"	"{6E4F176A-F628-4254-9EB0-BFC0DF707CCB}"	"String"	"huisnummer"	"Alfanumerieke code officieel toegekend aan gebouweenheden, ligplaatsen, standplaatsen of percelen."	"Specialisatie van Adresvoorstelling:locatieaanduiding tbv Belgische adressen."	""	"false"	"http://data.vlaanderen.be/ns/dienst#"	"Adresvoorstelling.huisnummer"	"http://www.w3.org/2002/07/owl#DatatypeProperty"	"http://www.w3.org/ns/locn#Address"	"http://www.w3.org/2001/XMLSchema#string"	"http://www.w3.org/ns/locn#locatorDesignator"	"0"	"1"
"attribute"	"OSLO²_applicatieprofiel_Dienst_transactiemodel"	"land"	"{56774CEA-05DA-4ffa-9CC1-D1317D446F74}"	""	"Adresvoorstelling"	"{6E4F176A-F628-4254-9EB0-BFC0DF707CCB}"	"Taalstring"	"land"	"Land waarin het adres gelegen is."	" "	""	"false"	"http://data.vlaanderen.be/ns/dienst#"	"land"	"http://www.w3.org/1999/02/22-rdf-syntax-ns#Property"	"http://www.w3.org/ns/locn#Address"	""	"http://www.w3.org/ns/locn#adminUnitL1"	"0"	"1"
"attribute"	"OSLO²_applicatieprofiel_Dienst_transactiemodel"	"locatieaanduiding"	"{0B3E5D20-8B18-4534-8122-0ABA803D2D85}"	""	"Adresvoorstelling"	"{6E4F176A-F628-4254-9EB0-BFC0DF707CCB}"	"String"	"locatieaanduiding"	"Alfanumerieke code die de adreslocator uniek identificeert binnen de straat, administratieve eenheid etc."	" "	""	"true"	"http://www.w3.org/ns/locn#"	"locatorDesignator"	"http://www.w3.org/2002/07/owl#DatatypeProperty"	"http://www.w3.org/ns/locn#Address"	"http://www.w3.org/2001/XMLSchema#string"	""	"0"	"1"
"attribute"	"OSLO²_applicatieprofiel_Dienst_transactiemodel"	"locatienaam"	"{528EA810-F90A-471f-AEEB-98F7D69CCFEC}"	""	"Adresvoorstelling"	"{6E4F176A-F628-4254-9EB0-BFC0DF707CCB}"	"Taalstring"	"locatienaam"	"Naam of omschrijving vh het geografisch object dat de adreslocator aanduidt."	" "	""	"true"	"http://www.w3.org/ns/locn#"	"locatorName"	"http://www.w3.org/1999/02/22-rdf-syntax-ns#Property"	"http://www.w3.org/ns/locn#Address"	""	""	"0"	"1"
"attribute"	"OSLO²_applicatieprofiel_Dienst_transactiemodel"	"postbus"	"{5CB881F5-C9F3-4e35-929B-C9827BED13E9}"	""	"Adresvoorstelling"	"{6E4F176A-F628-4254-9EB0-BFC0DF707CCB}"	"String"	"postbus"	"Postbusnummer in een postkantoor."	" "	""	"true"	"http://www.w3.org/ns/locn#"	"poBox"	"http://www.w3.org/2002/07/owl#DatatypeProperty"	"http://www.w3.org/ns/locn#Address"	"http://www.w3.org/2001/XMLSchema#string"	""	"0"	"1"
"attribute"	"OSLO²_applicatieprofiel_Dienst_transactiemodel"	"postcode"	"{433009FC-520E-4a15-82F0-B6C2B4418C95}"	""	"Adresvoorstelling"	"{6E4F176A-F628-4254-9EB0-BFC0DF707CCB}"	"String"	"postcode"	"Code waarmee het geografisch gebied dat adressen voor postale doeleinden groepeert wordt aangeduid."	" "	""	"true"	"http://www.w3.org/ns/locn#"	"postCode"	"http://www.w3.org/2002/07/owl#DatatypeProperty"	"http://www.w3.org/ns/locn#Address"	"http://www.w3.org/2001/XMLSchema#string"	""	"0"	"1"
"attribute"	"OSLO²_applicatieprofiel_Dienst_transactiemodel"	"postnaam"	"{CED8DF43-D4E4-4531-AC21-8EF90A39B5D6}"	""	"Adresvoorstelling"	"{6E4F176A-F628-4254-9EB0-BFC0DF707CCB}"	"Taalstring"	"postnaam"	"Naam waarmee het geografisch gebied dat adressen voor postale doeleinden groepeert wordt aangeduid."	" "	""	"true"	"http://www.w3.org/ns/locn#"	"postName"	"http://www.w3.org/1999/02/22-rdf-syntax-ns#Property"	"http://www.w3.org/ns/locn#Address"	""	""	"0"	"1"
"attribute"	"OSLO²_applicatieprofiel_Dienst_transactiemodel"	"straatnaam"	"{D7D0C425-5ABE-4353-B1C2-C61624938AA5}"	""	"Adresvoorstelling"	"{6E4F176A-F628-4254-9EB0-BFC0DF707CCB}"	"Taalstring"	"straatnaam"	"Straatnaam vh adres."	" "	""	"true"	"http://www.w3.org/ns/locn#"	"thoroughfare"	"http://www.w3.org/1999/02/22-rdf-syntax-ns#Property"	"http://www.w3.org/ns/locn#Address"	""	""	"0"	"1"
"attribute"	"OSLO²_applicatieprofiel_Dienst_transactiemodel"	"volledigAdres"	"{53E69EF5-3D6C-4231-AFDA-5E769DE3A441}"	""	"Adresvoorstelling"	"{6E4F176A-F628-4254-9EB0-BFC0DF707CCB}"	"Taalstring"	"volledig adres"	"Het complete adres in één string, al dan niet geformatteerd."	"Vermijdt fouten tgv het opsplitsen ve adres in zijn onderdelen. Geeft de voorgeschreven volgorde vd verschillende onderdelen weer. "	""	"true"	"http://www.w3.org/ns/locn#"	"fullAddress"	"http://www.w3.org/1999/02/22-rdf-syntax-ns#Property"	"http://www.w3.org/ns/locn#Address"	""	""	"0"	"1"
"attribute"	"OSLO²_applicatieprofiel_Dienst_transactiemodel"	"aanschrijfvorm"	"{8AF069D8-A68B-483f-B00B-003D07625E03}"	""	"ContactInfo"	"{EE4CD626-03C4-4ff7-AD24-2C0FC8E5A631}"	"TaalString"	"aanschrijfvorm"	"Titel waarmee iemand wordt aangeschreven of aangesproken of waarmee naar iemand wordt verwezen."	"Bvb De heer/Mevrouw, Excellentie, Dokter"	""	"true"	"http://ww.w3.org/2006/vcard/ns#"	"honorific-prefix"	"http://www.w3.org/1999/02/22-rdf-syntax-ns#Property"	"http://schema.org/ContactPoint"	""	""	"0"	"1"
"attribute"	"OSLO²_applicatieprofiel_Dienst_transactiemodel"	"adres"	"{D7CE476A-D1BE-4c43-9591-5F21C840F6B2}"	""	"ContactInfo"	"{EE4CD626-03C4-4ff7-AD24-2C0FC8E5A631}"	"Adresvoorstelling"	"adres"	"Adres dat men kan aanschrijven of bezoeken."	" "	""	"true"	"http://www.w3.org/ns/locn#"	"address"	"http://www.w3.org/2002/07/owl#ObjectProperty"	"http://schema.org/ContactPoint"	"http://www.w3.org/ns/locn#Address"	""	"0"	"1"
"attribute"	"OSLO²_applicatieprofiel_Dienst_transactiemodel"	"beschikbaarheid"	"{AAC91F13-BFD9-4668-9B94-D7CF65364FE4}"	""	"ContactInfo"	"{EE4CD626-03C4-4ff7-AD24-2C0FC8E5A631}"	"OpeningsurenSpecificatie"	"beschikbaarheid"	"Periode waarin contact kan worden opgenomen."	"Bv aanduiding van het seizoen waarin contact kan worden opgenoment aangeboden. Begin- en einddatum volgens ISO8601 syntax."	""	"true"	"http://schema.org/"	"hoursAvailable"	"http://www.w3.org/1999/02/22-rdf-syntax-ns#Property"	"http://schema.org/ContactPoint"	""	""	"0"	"1"
"attribute"	"OSLO²_applicatieprofiel_Dienst_transactiemodel"	"contactnaam"	"{A5FC42F6-1F43-4662-90E0-5874F0DF4A86}"	""	"ContactInfo"	"{EE4CD626-03C4-4ff7-AD24-2C0FC8E5A631}"	"String"	"contactnaam"	"Naam van bvb de persoon die men kan contacteren."	" "	""	"true"	"http://xmlns.com/foaf/0.1/"	"name"	"http://www.w3.org/2002/07/owl#DatatypeProperty"	"http://schema.org/ContactPoint"	"http://www.w3.org/2001/XMLSchema#string"	""	"0"	"1"
"attribute"	"OSLO²_applicatieprofiel_Dienst_transactiemodel"	"email"	"{5F2819C2-AD98-4ae5-8DF0-DC3AB7A146A2}"	""	"ContactInfo"	"{EE4CD626-03C4-4ff7-AD24-2C0FC8E5A631}"	"String"	"email"	"Email-adres waarnaar men kan mailen."	" "	""	"true"	"http://schema.org/"	"email"	"http://www.w3.org/2002/07/owl#DatatypeProperty"	"http://schema.org/ContactPoint"	"http://www.w3.org/2001/XMLSchema#string"	""	"0"	"1"
"attribute"	"OSLO²_applicatieprofiel_Dienst_transactiemodel"	"fax"	"{20788932-C339-47c8-9BA2-470DF0BE7BF6}"	""	"ContactInfo"	"{EE4CD626-03C4-4ff7-AD24-2C0FC8E5A631}"	"String"	"fax"	"Faxnummer waarnaar men kan faxen."	" "	""	"true"	"http://schema.org/"	"faxNumber"	"http://www.w3.org/2002/07/owl#DatatypeProperty"	"http://schema.org/ContactPoint"	"http://www.w3.org/2001/XMLSchema#string"	""	"0"	"1"
"attribute"	"OSLO²_applicatieprofiel_Dienst_transactiemodel"	"openingsuren"	"{A154AD9F-4332-4eb3-8C35-7327B65DD3B7}"	""	"ContactInfo"	"{EE4CD626-03C4-4ff7-AD24-2C0FC8E5A631}"	"OpeningsurenSpecificatie"	"openingsuren"	"Uren waarbinnen contact kan worden opgenomen."	"Syntax volgens schema.org voor openingsuren. Bv als contact kan worden opgenomen tussen 8 en 20u maandag tot zaterdag en tussen 8 en 18u op zondag wordt dit gecodeerd als Ma-za 08:00-20:00, zo 08:00-18:00."	""	"true"	"http://schema.org/"	"openingHours"	"http://www.w3.org/1999/02/22-rdf-syntax-ns#Property"	"http://schema.org/ContactPoint"	""	""	"0"	"1"
"attribute"	"OSLO²_applicatieprofiel_Dienst_transactiemodel"	"telefoon"	"{E8418EE5-2461-4abd-A669-47C0E83B9BFB}"	""	"ContactInfo"	"{EE4CD626-03C4-4ff7-AD24-2C0FC8E5A631}"	"String"	"telefoon"	"Telefoonnummer waarop men kan bellen."	" "	""	"true"	"http://schema.org/"	"telephone"	"http://www.w3.org/2002/07/owl#DatatypeProperty"	"http://schema.org/ContactPoint"	"http://www.w3.org/2001/XMLSchema#string"	""	"0"	"1"
"attribute"	"OSLO²_applicatieprofiel_Dienst_transactiemodel"	"website"	"{5BCA2244-72AD-49e8-964A-6D4283DED585}"	""	"ContactInfo"	"{EE4CD626-03C4-4ff7-AD24-2C0FC8E5A631}"	"URI"	"website"	"Website waarnaar men kan surfen."	" "	""	"true"	"http://xmlns.com/foaf/0.1/"	"page"	"http://www.w3.org/2002/07/owl#DatatypeProperty"	"http://schema.org/ContactPoint"	"http://www.w3.org/2001/XMLSchema#anyURI"	""	"0"	"1"
"attribute"	"OSLO²_applicatieprofiel_Dienst_transactiemodel"	"actie"	"{E6022C2B-845D-4f5e-80D6-DAEA16FBCF0D}"	""	"Status"	"{7A2485BA-C313-4925-A739-3B8FCE7ABE44}"	"String"	"actie"	"Omschrijving van de uit te voeren actie."	""	""	"true"	"https://beta.dosis.vlaanderen.be/api/help/model?modelnaam="	"StatusActie"	"http://www.w3.org/2002/07/owl#DatatypeProperty"	"http://data.vlaanderen.be/ns/dienst#Status"	"http://www.w3.org/2001/XMLSchema#string"	""	"0"	"1"
"attribute"	"OSLO²_applicatieprofiel_Dienst_transactiemodel"	"actieNodig"	"{8D9A1A97-793B-4aab-BE4B-A4927032386A}"	""	"Status"	"{7A2485BA-C313-4925-A739-3B8FCE7ABE44}"	"Boolean"	"actie nodig"	"Aanduiding of de huidige status impliceert dat er actie van burger of onderneming nodig is."	""	""	"true"	"https://beta.dosis.vlaanderen.be/api/help/model?modelnaam="	"StatusActieNodig"	"http://www.w3.org/2002/07/owl#DatatypeProperty"	"http://data.vlaanderen.be/ns/dienst#Status"	"http://www.w3.org/2001/XMLSchema#boolean"	""	"0"	"1"
"attribute"	"OSLO²_applicatieprofiel_Dienst_transactiemodel"	"statusdatum"	"{6923F9EC-4DA7-4790-A623-97E195539069}"	""	"Status"	"{7A2485BA-C313-4925-A739-3B8FCE7ABE44}"	"Date"	"statusdatum"	"De datum van de Status."	"Bijvoorbeeld de status wijzigingsdatum."	""	"false"	"http://data.vlaanderen.be/ns/dienst#"	"statusdatum"	"http://www.w3.org/2002/07/owl#DatatypeProperty"	"http://data.vlaanderen.be/ns/dienst#Status"	"http://www.w3.org/2001/XMLSchema#date"	""	"0"	"1"
"attribute"	"OSLO²_applicatieprofiel_Dienst_transactiemodel"	"statusDetail1"	"{2F7A5E86-1137-477a-9D01-40794AADE659}"	""	"Status"	"{7A2485BA-C313-4925-A739-3B8FCE7ABE44}"	"String"	"status detail 1"	"Dit is de (originele) Status-definitie of -vermelding zoals geregistreerd in de bron."	"Indien ingevuld wordt deze informatie meegegeven aan de burger of onderneming."	""	"false"	"http://data.vlaanderen.be/ns/dienst#"	"statusDetail1"	"http://www.w3.org/2002/07/owl#DatatypeProperty"	"http://data.vlaanderen.be/ns/dienst#Status"	"http://www.w3.org/2001/XMLSchema#string"	""	"0"	"1"
