"EA-Type"	"EA-Package"	"EA-Name"	"EA-GUID"	"EA-Parent"	"EA-Domain"	"EA-Domain-GUID"	"EA-Range"	"ap-label-nl"	"ap-definition-nl"	"ap-usageNote-nl"	"ap-codelist"	"external term"	"namespace"	"localname"	"type"	"domain"	"range"	"parent"	"min card"	"max card"
"CLASS"	"InfrastructuurElement"	"Roodlichtcamera"	"{88883D3D-0C4F-4cf8-83BA-D8773A7BA2BF}"	"Camera"	""	""	""	"Roodlichtcamera"	"Een meettoestel waarmee zowel snelheidsovertredingen als het negeren van een rood verkeerslicht kunnen worden vastgesteld."	""	""	"false"	"http://data.vlaanderen.be/ns/infrastructuur#"	"Roodlichtcamera"	"http://www.w3.org/2000/01/rdf-schema#Class"	""	""	"http://data.vlaanderen.be/ns/infrastructuur#Camera"	""	""
"CLASS"	"InfrastructuurElement"	"Snelheidscamera"	"{BBD50D66-9F8D-478d-A6AB-E278E6413AE8}"	"Camera"	""	""	""	"Snelheidscamera"	"Een meettoestel waarmee snelheidsovertredingen vastgesteld kunnen worden."	""	""	"false"	"http://data.vlaanderen.be/ns/infrastructuur#"	"Snelheidscamera"	"http://www.w3.org/2000/01/rdf-schema#Class"	""	""	"http://data.vlaanderen.be/ns/infrastructuur#Camera"	""	""
"CLASS"	"InfrastructuurElement"	"ANPRCamera"	"{C326E0FF-FE61-4940-B61E-B40E8206495B}"	"Camera"	""	""	""	"ANPR camera"	"Een toestel dat gebruikt wordt voor automatische nummerplaatherkenning."	""	""	"false"	"http://data.vlaanderen.be/ns/infrastructuur#"	"ANPRCamera"	"http://www.w3.org/2000/01/rdf-schema#Class"	""	""	"http://data.vlaanderen.be/ns/infrastructuur#Camera"	""	""
"CLASS"	"InfrastructuurElement"	"Debietmeter"	"{6694F837-773E-4fd5-B840-28168A3806A8}"	"Sensor"	""	""	""	"Debietmeter"	"Een meettoestel bevestigd in of langs een waterloop die het aantal kubieke meter water registreert dat op een bepaald punt in een waterloop per seconde passeer."	"Bron object: GRB: WRM3 Debietmeter"	""	"false"	"http://data.vlaanderen.be/ns/infrastructuur#"	"Debietmeter"	"http://www.w3.org/2000/01/rdf-schema#Class"	""	""	"http://data.vlaanderen.be/ns/infrastructuur#Sensor"	""	""
"CLASS"	"InfrastructuurElement"	"CultuurhistorischMonument"	"{F55A656B-20DE-49fb-A22C-B641C942288B}"	"Straatmeubilair"	""	""	""	"Cultuurhistorisch monument"	"Een cultuurhistorisch monument is een zichtbare constructie met historische, esthetische of landschappelijke waarde opgetrokken uit duurzame materialen."	"Bron object: GRB KNW3 Cultuurhistorisch monument"	""	"false"	"http://data.vlaanderen.be/ns/infrastructuur#"	"CultuurhistorischMonument"	"http://www.w3.org/2000/01/rdf-schema#Class"	""	""	"http://data.vlaanderen.be/ns/infrastructuur#Straatmeubilair"	""	""
"CLASS"	"InfrastructuurElement"	"Wegmarkering"	"{4DE4721F-9E59-4b71-8B75-A53E703D987D}"	"Wegsignalisatie"	""	""	""	"Wegmarkering"	"Schilderingen aangebracht op het verhard gedeelte van de wegbaan of kleurveranderingen van de verharding die een onderdeel vormen van de verkeerswetgeving."	""	""	"false"	"http://data.vlaanderen.be/ns/infrastructuur#"	"Wegmarkering"	"http://www.w3.org/2000/01/rdf-schema#Class"	""	""	"http://data.vlaanderen.be/ns/infrastructuur#Wegsignalisatie"	""	""
"CLASS"	"InfrastructuurElement"	"PuntvormigeWegmarkering"	"{A1F7B8B7-9EB1-4ae4-BEF5-59674E5787AE}"	"Wegmarkering"	""	""	""	"Puntvormige wegmarkering"	"Puntvormige schilderingen aangebracht op het verhard gedeelte van de wegbaan en die een onderdeel vormen van de verkeerswetgeving."	"Bron object: GRB WEM1: Puntvormige wegmarkering"	""	"false"	"http://data.vlaanderen.be/ns/infrastructuur#"	"PuntvormigeWegmarkering"	"http://www.w3.org/2000/01/rdf-schema#Class"	""	""	"http://data.vlaanderen.be/ns/infrastructuur#Wegmarkering"	""	""
"CLASS"	"InfrastructuurElement"	"LijnvormigeWegmarkering"	"{74F739BE-8871-4988-8C63-AA97B13B3FDA}"	"Wegmarkering"	""	""	""	"Lijnvormige wegmarkering"	"Lijnvormige schilderingen aangebracht op het verhard gedeelte van de wegbaan of kleurveranderingen van de verharding die een onderdeel vormen van de verkeerswetgeving."	"Bron object: GRB WEM2: Lijnvormige wegmarkering"	""	"false"	"http://data.vlaanderen.be/ns/infrastructuur#"	"LijnvormigeWegmarkering"	"http://www.w3.org/2000/01/rdf-schema#Class"	""	""	"http://data.vlaanderen.be/ns/infrastructuur#Wegmarkering"	""	""
"CLASS"	"InfrastructuurElement"	"VlakvormigeWegmarkering"	"{E73740F8-265A-4b7a-9223-D523FAE686C1}"	"Wegmarkering"	""	""	""	"Vlakvormige wegmarkering"	"Vlakvormige schilderingen aangebracht op het verhard gedeelte van de wegbaan of kleurveranderingen van de verharding die een onderdeel vormen van de verkeerswetgeving."	"Bron object: GRB WEM3: Vlakvormige wegmarkering"	""	"false"	"http://data.vlaanderen.be/ns/infrastructuur#"	"VlakvormigeWegmarkering"	"http://www.w3.org/2000/01/rdf-schema#Class"	""	""	"http://data.vlaanderen.be/ns/infrastructuur#Wegmarkering"	""	""
"CLASS"	"InfrastructuurElement"	"SignalisatieScheepvaart"	"{08E7FCCC-4F81-4f0a-A37A-A752A286A929}"	"Signalisatie"	""	""	""	"Signalisatie scheepvaart"	"TODO"	""	""	"false"	"http://data.vlaanderen.be/ns/infrastructuur#"	"SignalisatieScheepvaart"	"http://www.w3.org/2000/01/rdf-schema#Class"	""	""	"http://data.vlaanderen.be/ns/infrastructuur#Signalisatie"	""	""
"CLASS"	"InfrastructuurElement"	"SignalisatieScheepvaartElektrisch"	"{B025C8C6-8AB6-4110-A196-805CE3A83C1F}"	"SignalisatieScheepvaart"	""	""	""	"Signalisatie scheepvaart elektrisch"	"TODO"	"Bron object: GRB WRS2: Signalisatie scheepvaart elektrisch"	""	"false"	"http://data.vlaanderen.be/ns/infrastructuur#"	"SignalisatieScheepvaartElektrisch"	"http://www.w3.org/2000/01/rdf-schema#Class"	""	""	"http://data.vlaanderen.be/ns/infrastructuur#SignalisatieScheepvaart"	""	""
"CLASS"	"InfrastructuurElement"	"SignalisatieScheepvaartNietElektrisch"	"{D07398FA-7C75-4d19-B104-D1F533A703C6}"	"SignalisatieScheepvaart"	""	""	""	"Signalisatie scheepvaart niet-elektrisch"	"TODO"	"Bron object: GRB WRS2: Signalisatie scheepvaart niet-elektrisch"	""	"false"	"http://data.vlaanderen.be/ns/infrastructuur#"	"SignalisatieScheepvaartNietElektrisch"	"http://www.w3.org/2000/01/rdf-schema#Class"	""	""	"http://data.vlaanderen.be/ns/infrastructuur#SignalisatieScheepvaart"	""	""
"CLASS"	"InfrastructuurElement"	"Paneelafsluiting"	"{E7A7B6AB-1A74-4170-8847-F2C5A30ED036}"	"BestendigeAfsluiting"	""	""	""	"Paneel"	"Een afsluiting opgebouwd uit een of meerdere panelen."	"Bron object: GRB AFS: Afsluiting - houten paneel en afsluiting"	""	"false"	"http://data.vlaanderen.be/ns/infrastructuur#"	"Paneelafsluiting"	"http://www.w3.org/2000/01/rdf-schema#Class"	""	""	"http://data.vlaanderen.be/ns/infrastructuur#BestendigeAfsluiting"	""	""
"CLASS"	"InfrastructuurElement"	"SpandraadKetting"	"{A2B1DD7A-65B2-47cf-A4FA-A425061987E5}"	"Afsluiting"	""	""	""	"Afsluiting spandraad en -ketting"	"Een afsluiting bestaande uit spandraad en/of kettingen."	"Bron object: GRB AFS: Afsluiting - Spandraad en -ketting"	""	"false"	"http://data.vlaanderen.be/ns/infrastructuur#"	"SpandraadKetting"	"http://www.w3.org/2000/01/rdf-schema#Class"	""	""	"http://data.vlaanderen.be/ns/infrastructuur#Afsluiting"	""	""
"CLASS"	"InfrastructuurElement"	"Signalisatie"	"{378D751F-68C2-4a9c-ADD8-F0CB1256109C}"	"Infrastructuurelement"	""	""	""	"Signalisatie"	"Alle soorten borden aangebracht ten behoeve van de weggebruiker, bijvoorbeeld: reflectorpaaltjes, palen voor verkeersborden, wegwijzers, plaatsnaamborden, straatnaambord, bord bebouwde kom, signalisatiepalen openbaar vervoer."	""	""	"false"	"http://data.vlaanderen.be/ns/infrastructuur#"	"Signalisatie"	"http://www.w3.org/2000/01/rdf-schema#Class"	""	""	"http://data.vlaanderen.be/ns/infrastructuur#Infrastructuurelement"	""	""
"CLASS"	"InfrastructuurElement"	"Weginrichtingselement"	"{97ED7AFE-1C8C-4f9a-BAFF-873D14378146}"	"Infrastructuurelement"	""	""	""	"Weginrichtingselement"	"Een element behorende bij of gelegen binnen de wegbaan."	""	""	"false"	"http://data.vlaanderen.be/ns/infrastructuur#"	"Weginrichtingselement"	"http://www.w3.org/2000/01/rdf-schema#Class"	""	""	"http://data.vlaanderen.be/ns/infrastructuur#Infrastructuurelement"	""	""
"attribute"	"InfrastructuurElement"	"materiaal"	"{5D1C68E1-F440-48ff-BA9F-0550F011E0FB}"	""	"Infrastructuurelement"	"{BE978AD9-6EC3-4227-80B7-7D4FE8305601}"	"Materialen"	"materiaal"	"Materiaal waar het object uit vervaardigd is."	""	"https://thesaurus.onroerenderfgoed.be/conceptschemes/MATERIALEN"	"false"	"http://data.vlaanderen.be/ns/infrastructuur#"	"materiaal"	"http://www.w3.org/2002/07/owl#ObjectProperty"	"http://data.vlaanderen.be/ns/infrastructuur#Infrastructuurelement"	"http://www.w3.org/2004/02/skos/core#Concept"	""	"0"	"*"
"attribute"	"Model"	"begindatum"	"{8C952A4E-0982-4b13-8600-70656D8FE5FF}"	""	"Object"	"{0C707DB5-1D87-4604-8A06-36F07898FB03}"	"DateTime"	"begindatum"	"Datum waarop de huidige versie van het gebied of object in gebruik wordt genomen."	""	""	"true"	"http://data.vlaanderen.be/ns/openbaardomein#"	"begindatum"	"http://www.w3.org/2002/07/owl#DatatypeProperty"	"http://www.w3.org/2000/01/rdf-schema#Resource"	"http://www.w3.org/2001/XMLSchema#dateTime"	""	"0"	"1"
"attribute"	"Model"	"einddatum"	"{4F5A2878-E02F-44b7-957E-40E5E7C39AE9}"	""	"Object"	"{0C707DB5-1D87-4604-8A06-36F07898FB03}"	"DateTime"	"einddatum"	"Datum waarop de huidige versie van het beheerobject uit gebruik wordt genomen."	""	""	"true"	"http://data.vlaanderen.be/ns/openbaardomein#"	"einddatum"	"http://www.w3.org/2002/07/owl#DatatypeProperty"	"http://www.w3.org/2000/01/rdf-schema#Resource"	"http://www.w3.org/2001/XMLSchema#dateTime"	""	"0"	"1"
"attribute"	"Model"	"niveau"	"{48EBC730-AAD3-4933-866F-91A77EB4014A}"	""	"Object"	"{0C707DB5-1D87-4604-8A06-36F07898FB03}"	"Integer"	"niveau"	"Het niveau waarop het object zich bevindt."	"Negatieve waarden worden geassocieerd met ondergrond, nul met gelijkgronds en positieve waarden met bovengronds."	""	"true"	"http://data.vlaanderen.be/ns/openbaardomein#"	"niveau"	"http://www.w3.org/2002/07/owl#DatatypeProperty"	"http://data.vlaanderen.be/ns/openbaardomein#Object"	"http://www.w3.org/2001/XMLSchema#integer"	""	"0"	"1"
"attribute"	"Model"	"geometrie"	"{D0642712-C066-4503-B618-BB35671F2727}"	""	"Object"	"{0C707DB5-1D87-4604-8A06-36F07898FB03}"	"Geometrie"	"geometrie"	"De geometrie overeenkomstig met een bepaald object."	""	""	"true"	"http://www.w3.org/ns/locn#"	"geometry"	"http://www.w3.org/2002/07/owl#ObjectProperty"	"http://data.vlaanderen.be/ns/openbaardomein#Object"	"http://www.opengis.net/ont/geosparql#Geometry"	""	"1"	"1"
"attribute"	"Model"	"meetmethode"	"{C8476B1B-390B-4fa3-A3D3-C1B211E2C693}"	""	"Object"	"{0C707DB5-1D87-4604-8A06-36F07898FB03}"	"Meetmethode"	"meetmethode"	"De methode waarmee de inventarisatie is opgemeten."	""	""	"true"	"http://data.vlaanderen.be/ns/openbaardomein#"	"meetmethode"	"http://www.w3.org/2002/07/owl#ObjectProperty"	"http://data.vlaanderen.be/ns/openbaardomein#Object"	"http://data.vlaanderen.be/ns/openbaardomein#Meetmethode"	""	"1"	"1"
"attribute"	"Model"	"relatie"	"{6B595E84-9F0B-4410-B9F4-3D8C305C0461}"	""	"Object"	"{0C707DB5-1D87-4604-8A06-36F07898FB03}"	"RelatieObject"	"relatie"	"Verwijst naar een object in een andere databank dat meer informatie kan verschaffen over het beheerobject."	"Bijvoorbeeld een verwijzing naar een object uit het wegenregister of grootschalig referentiebestand."	""	"true"	"http://purl.org/dc/terms/"	"relation"	"http://www.w3.org/2002/07/owl#ObjectProperty"	"http://data.vlaanderen.be/ns/openbaardomein#Object"	"http://www.w3.org/2000/01/rdf-schema#Resource"	""	"0"	"*"
"attribute"	"InfrastructuurElement"	"nutsvoorzieningscode"	"{160DD3FB-6B0D-4bd1-B595-B12D04D63BC1}"	""	"Deksel"	"{85234889-E08C-4c23-AA7E-66E15185B949}"	"Literal"	"nutsvoorzieningscode"	"Aanduiding van de soort nutsvoorziening."	"Gebruik de GRB codelijst: WNC nutsvoorzieningscode."	"https://www.agiv.be/~/media/agiv/producten/grb/documenten/grb-objectencatalogus/grb-skeletcomponenten/skeletoptie%20wegbeheer/wnc.pdf"	"false"	"http://data.vlaanderen.be/ns/infrastructuur#"	"nutsvoorzieningscode"	"http://www.w3.org/2002/07/owl#DatatypeProperty"	"http://data.vlaanderen.be/ns/infrastructuur#Infrastructuurelement"	"http://www.w3.org/2000/01/rdf-schema#Literal"	""	"0"	"1"
"attribute"	"InfrastructuurElement"	"dekselVorm"	"{A58CABD0-65BA-469a-B4EA-B1EE7E14ECD4}"	""	"Deksel"	"{85234889-E08C-4c23-AA7E-66E15185B949}"	"DekselVormWaarde"	"deksel vorm"	"De vorm van het deksel."	""	""	"false"	"http://data.vlaanderen.be/ns/infrastructuur#"	"dekselVorm"	"http://www.w3.org/2002/07/owl#ObjectProperty"	"http://data.vlaanderen.be/ns/infrastructuur#Deksel"	"http://www.w3.org/2004/02/skos/core#Concept"	""	"1"	"1"
"attribute"	"InfrastructuurElement"	"rioleringscode"	"{80D5C5C1-7C28-441b-93EF-F563E216F824}"	""	"Deksel"	"{85234889-E08C-4c23-AA7E-66E15185B949}"	"Literal"	"rioleringscode"	"De rioleringscode is een arbitraire notitie van waarneembare eigenschappen van het deksel m.b.t. de beheerder en de functie van de ondergrondse ioleringsleiding."	"Gebruik de GRB codelijst: WRC1: Rioleringscode."	"https://www.agiv.be/~/media/agiv/producten/grb/documenten/grb-objectencatalogus/grb-skeletcomponenten/skeletoptie%20wegbeheer/wnc.pdf"	"false"	"http://data.vlaanderen.be/ns/infrastructuur#"	"rioleringscode"	"http://www.w3.org/2002/07/owl#DatatypeProperty"	"http://data.vlaanderen.be/ns/infrastructuur#Infrastructuurelement"	"http://www.w3.org/2000/01/rdf-schema#Literal"	""	"0"	"1"
"attribute"	"InfrastructuurElement"	"nutsvoorzieningscode"	"{3CF10F64-136A-4f6a-86D6-B392D6F00AA8}"	""	"Nutskast"	"{D50BB4A0-BFD9-4588-B406-49E9E801CE69}"	"Literal"	"nutsvoorzieningscode"	"Aanduiding van de soort nutsvoorziening."	"Gebruik de GRB codelijst: WNC nutsvoorzieningscode."	"https://www.agiv.be/~/media/agiv/producten/grb/documenten/grb-objectencatalogus/grb-skeletcomponenten/skeletoptie%20wegbeheer/wnc.pdf"	"false"	"http://data.vlaanderen.be/ns/infrastructuur#"	"nutsvoorzieningscode"	"http://www.w3.org/2002/07/owl#DatatypeProperty"	"http://data.vlaanderen.be/ns/infrastructuur#Infrastructuurelement"	"http://www.w3.org/2000/01/rdf-schema#Literal"	""	"1"	"1"
"attribute"	"InfrastructuurElement"	"nutsvoorzieningscode"	"{E4C7C93C-9581-489d-BF77-F31608527EC7}"	""	"Nutspaal"	"{DDDCD57B-ED48-473d-84CC-784E488CA126}"	"Literal"	"nutsvoorzieningscode"	"Aanduiding van de soort nutsvoorziening."	"Gebruik de GRB codelijst: WNC nutsvoorzieningscode."	"https://www.agiv.be/~/media/agiv/producten/grb/documenten/grb-objectencatalogus/grb-skeletcomponenten/skeletoptie%20wegbeheer/wnc.pdf"	"false"	"http://data.vlaanderen.be/ns/infrastructuur#"	"nutsvoorzieningscode"	"http://www.w3.org/2002/07/owl#DatatypeProperty"	"http://data.vlaanderen.be/ns/infrastructuur#Infrastructuurelement"	"http://www.w3.org/2000/01/rdf-schema#Literal"	""	"1"	"*"
"attribute"	"InfrastructuurElement"	"speeltoesteltype"	"{11D169BF-DF59-40e0-A3FA-6991246DF71A}"	""	"SpeelEnSportvoorziening"	"{0A5C9C6B-44D7-4434-8B7C-86A9FFF35556}"	"SpeeltoesteltypeWaarde"	"speeltoesteltype"	"Het type speeltoestel."	"Type van speelvoorziening uit de lijst Categorie EN1176"	""	"false"	"http://data.vlaanderen.be/ns/infrastructuur#"	"speeltoesteltype"	"http://www.w3.org/2002/07/owl#ObjectProperty"	"http://data.vlaanderen.be/ns/infrastructuur#SpeelEnSportvoorziening"	"http://www.w3.org/2004/02/skos/core#Concept"	""	"1"	"1"
"attribute"	"InfrastructuurElement"	"nutsvoorzieningscode"	"{DB2C9D72-2B6A-4757-8699-779AC2D4CB37}"	""	"SignalisatieEnLeidingenportiek"	"{D0DDA235-9B9E-4168-8796-EC0D54A695AB}"	"Literal"	"nutsvoorzieningscode"	"Aanduiding van de soort nutsvoorziening."	"Gebruik de GRB codelijst: WNC nutsvoorzieningscode."	"https://www.agiv.be/~/media/agiv/producten/grb/documenten/grb-objectencatalogus/grb-skeletcomponenten/skeletoptie%20wegbeheer/wnc.pdf"	"false"	"http://data.vlaanderen.be/ns/infrastructuur#"	"nutsvoorzieningscode"	"http://www.w3.org/2002/07/owl#DatatypeProperty"	"http://data.vlaanderen.be/ns/infrastructuur#Infrastructuurelement"	"http://www.w3.org/2000/01/rdf-schema#Literal"	""	"0"	"*"
"attribute"	"InfrastructuurElement"	"drinkbaar"	"{62E6AA92-7551-41b0-9262-866DA74A4942}"	""	"Watertappunt"	"{8485FE92-0A48-4e04-B551-C7CC8B02D9C9}"	"Boolean"	"brandkraan"	"Geschikt voor menselijke consumptie."	""	""	"false"	"http://data.vlaanderen.be/ns/infrastructuur#"	"drinkbaar"	"http://www.w3.org/2002/07/owl#DatatypeProperty"	"http://data.vlaanderen.be/ns/infrastructuur#Watertappunt"	"http://www.w3.org/2001/XMLSchema#boolean"	""	"1"	"1"
"attribute"	"InfrastructuurElement"	"aantalAnkerpunten"	"{45C2F7A8-B5AC-48ba-87B6-0467B3515708}"	""	"Mast"	"{07DE8B9E-3F3F-4250-8BE8-8DB68F512933}"	"Int"	"aantal ankerpunten"	"Het aantal bevestigingspunten waarmee de mast verankerd is aan het aardoppervlak."	""	""	"false"	"http://data.vlaanderen.be/ns/infrastructuur#"	"aantalAnkerpunten"	"http://www.w3.org/2002/07/owl#DatatypeProperty"	"http://data.vlaanderen.be/ns/infrastructuur#Mast"	"http://www.w3.org/2001/XMLSchema#int"	""	"1"	"1"
"attribute"	"InfrastructuurElement"	"verplaatsbaar"	"{1294A1BD-955E-445d-9772-2AC98CC7A710}"	""	"Straatmeubilair"	"{3A18D60B-AA86-4805-AF35-807DC773C178}"	"Boolean"	"verplaatsbaar"	"Duidt aan of het element al dan niet verplaatsbaar is en dus niet permanent verankerd werd met het aardoppervlak."	""	""	"false"	"http://data.vlaanderen.be/ns/infrastructuur#"	"verplaatsbaar"	"http://www.w3.org/2002/07/owl#DatatypeProperty"	"http://data.vlaanderen.be/ns/openbaardomein#Element"	"http://www.w3.org/2001/XMLSchema#boolean"	""	"1"	"1"
"attribute"	"InfrastructuurElement"	"afsluitbaar"	"{1FC0079E-6798-4e2d-8182-8D17672CE55F}"	""	"Fietsstalling"	"{9DCBB855-B955-448c-9664-A81D84AA87CB}"	"Boolean"	"afsluitbaar"	"Duidt aan of de fietsstalling al dan niet kan afgesloten worden om toegang voor onbevoegden te verhinderen."	""	""	"false"	"http://data.vlaanderen.be/ns/infrastructuur#"	"afsluitbaar"	"http://www.w3.org/2002/07/owl#DatatypeProperty"	"http://data.vlaanderen.be/ns/infrastructuur#Infrastructuurelement"	"http://www.w3.org/2001/XMLSchema#boolean"	""	"1"	"1"
"attribute"	"InfrastructuurElement"	"overdekt"	"{DB820623-399E-4db9-981C-D5C0868DF183}"	""	"Fietsstalling"	"{9DCBB855-B955-448c-9664-A81D84AA87CB}"	"Boolean"	"afsluitbaar"	"Duidt aan of de fietsstalling al dan niet overdekt is."	""	""	"false"	"http://data.vlaanderen.be/ns/infrastructuur#"	"overdekt"	"http://www.w3.org/2002/07/owl#DatatypeProperty"	"http://data.vlaanderen.be/ns/infrastructuur#Infrastructuurelement"	"http://www.w3.org/2001/XMLSchema#boolean"	""	"1"	"1"
"attribute"	"InfrastructuurElement"	"capaciteit"	"{3B16FF90-484C-41a1-B72C-3305ABCF7D4F}"	""	"Fietsstalling"	"{9DCBB855-B955-448c-9664-A81D84AA87CB}"	"Int"	"capaciteit"	"Geeft aan hoeveel fietsen gestald kunnen worden aan of in de fietsenstalling."	""	""	"false"	"http://data.vlaanderen.be/ns/infrastructuur#"	"capaciteit"	"http://www.w3.org/2002/07/owl#DatatypeProperty"	"http://schema.org/Thing"	"http://www.w3.org/2001/XMLSchema#int"	""	"1"	"1"
