"EA-Type"	"EA-Package"	"EA-Name"	"EA-GUID"	"EA-Parent"	"EA-Domain"	"EA-Domain-GUID"	"EA-Range"	"ap-label-nl"	"ap-definition-nl"	"ap-usageNote-nl"	"ap-codelist"	"external term"	"namespace"	"localname"	"type"	"domain"	"range"	"parent"	"min card"	"max card"
"CLASS"	"InfrastructuurElement"	"Straatmeubilair"	"{3A18D60B-AA86-4805-AF35-807DC773C178}"	"Infrastructuurelement"	""	""	""	"Straatmeubilair"	"Straatmeubilair is  een diverse groep van objecten die in het algemeen in de openbare ruimte staan (zowel corridor- als surplusgebied)"	""	""	"false"	"http://data.vlaanderen.be/ns/infrastructuur#"	"Straatmeubilair"	"http://www.w3.org/2000/01/rdf-schema#Class"	""	""	"http://data.vlaanderen.be/ns/infrastructuur#Infrastructuurelement"	""	""
"CLASS"	"InfrastructuurElement"	"Barbecuetoestel"	"{38FF31E3-F731-4ae9-8B97-9BA9A77879D9}"	"Straatmeubilair"	""	""	""	"Barbecuetoestel"	"Barbecuetoestel bedoeld voor publiek gebruik"	""	""	"false"	"http://data.vlaanderen.be/ns/infrastructuur#"	"Barbecuetoestel"	"http://www.w3.org/2000/01/rdf-schema#Class"	""	""	"http://data.vlaanderen.be/ns/infrastructuur#Straatmeubilair"	""	""
"CLASS"	"InfrastructuurElement"	"Boombeugel"	"{8FE1BBAF-AB64-4c4a-9312-EE7DC3746F68}"	"Straatmeubilair"	""	""	""	"Boombeugel"	"Een boombeugel is een verticale structuur die enerzijds zorgt voor een adequate bescherming van bomen tegen auto's, fietsen, bromfietsen, en de anderzijds ook de nodige steun biedt bij het opgroeien van jonge bomen."	"Bron definitie: naar GRB-skeletoptie groen- en begraafplaatsenbeheer: WGB: Boombeugel"	""	"false"	"http://data.vlaanderen.be/ns/infrastructuur#"	"Boombeugel"	"http://www.w3.org/2000/01/rdf-schema#Class"	""	""	"http://data.vlaanderen.be/ns/infrastructuur#Straatmeubilair"	""	""
"CLASS"	"InfrastructuurElement"	"Boomrooster"	"{DA42A0C3-EC8B-4922-9F0E-2AD0119E088E}"	"Straatmeubilair"	""	""	""	"Boomrooster"	"Een horizontale structuur die zorgt voor een adequate bescherming van bomen tegen betreding van de boomspiegel door voetgangers of verkeer. Bijkomend zorgen boomroosters voor veiligheid van vooral voetgangers en fietsers doordat het maaiveld rondom de bomen gelijk blijft met de rest van de verharding waarin ze gelegen zijn."	""	""	"false"	"http://data.vlaanderen.be/ns/infrastructuur#"	"Boomrooster"	"http://www.w3.org/2000/01/rdf-schema#Class"	""	""	"http://data.vlaanderen.be/ns/infrastructuur#Straatmeubilair"	""	""
"CLASS"	"InfrastructuurElement"	"Fietsstalling"	"{9DCBB855-B955-448c-9664-A81D84AA87CB}"	"Straatmeubilair"	""	""	""	"Fietsstalling"	"Een fietsstalling is het geheel aan palen en/of verankeringspunten van een constructie bestemd voor het vastmaken van fietsen, gelegen op het openbare domein."	"Bron object: GRB WPI16: Fietsstalling"	""	"false"	"http://data.vlaanderen.be/ns/infrastructuur#"	"Fietsstalling"	"http://www.w3.org/2000/01/rdf-schema#Class"	""	""	"http://data.vlaanderen.be/ns/infrastructuur#Straatmeubilair"	""	""
"CLASS"	"InfrastructuurElement"	"Lichtpunt"	"{4DDA0EF8-C1EF-4d33-9D61-A56260CE3313}"	"OpenbareVerlichting"	""	""	""	"Lichtpunt"	"Elk lichtpunt dat is ingewerkt in het maaiveld of op een paaltje op beperkte hoogte boven het maaiveld (tot 2 meter) en dat gebruikt wordt als randverlichting (bvb verlichting van monument, parking,...), naast de openbare straatverlichting"	"Bron definitie: GRB-skeletaanvulling detail : WPI20: Lichtpunt"	""	"false"	"http://data.vlaanderen.be/ns/infrastructuur#"	"Lichtpunt"	"http://www.w3.org/2000/01/rdf-schema#Class"	""	""	"http://data.vlaanderen.be/ns/infrastructuur#OpenbareVerlichting"	""	""
"CLASS"	"InfrastructuurElement"	"Meerpaal"	"{76CF614C-629B-43d9-BA73-A8374E0C61FE}"	"Infrastructuurelement"	""	""	""	"Meerpaal"	"Een paal/bolder, gelegen aan de rand van grote waterpartijen en van een speciale vorm voorzien om een schip vast te kunnen leggen bij het aanmeren. Een meerpaal is in principe hetzelfde als een bolder."	"Bron object: GRB-entiteit: Meerpaal (WPI3)"	""	"false"	"http://data.vlaanderen.be/ns/infrastructuur#"	"Meerpaal"	"http://www.w3.org/2000/01/rdf-schema#Class"	""	""	"http://data.vlaanderen.be/ns/infrastructuur#Infrastructuurelement"	""	""
"CLASS"	"InfrastructuurElement"	"Vlaggenpaal"	"{B9521F51-3F66-4e70-A5A4-BEF1507C491A}"	"Straatmeubilair"	""	""	""	"Vlaggenpaal"	"Paal, permanent en duurzaam verankerd met de bodem en opgericht voor het bevestigen en hijsen van vlaggen."	"Bron definitie: GRB-skeletaanvulling detail: WPI24: Vlaggenpaal"	""	"false"	"http://data.vlaanderen.be/ns/infrastructuur#"	"Vlaggenpaal"	"http://www.w3.org/2000/01/rdf-schema#Class"	""	""	"http://data.vlaanderen.be/ns/infrastructuur#Straatmeubilair"	""	""
"CLASS"	"InfrastructuurElement"	"StatischeWegmonoliet"	"{D88A4172-2D76-4157-8B0C-AA821FD1ADB9}"	"Wegmonoliet"	""	""	""	"Statische wegmonoliet"	"Een niet-verzinkbare massief obstakel dat de doorgang van voertuigen belet"	"Bijvoorbeeld, 'Amsterdammers'. Bron definitie: naar GRB-skeletaanvulling detail: WPI14: Wegmonoliet"	""	"false"	"http://data.vlaanderen.be/ns/infrastructuur#"	"StatischeWegmonoliet"	"http://www.w3.org/2000/01/rdf-schema#Class"	""	""	"http://data.vlaanderen.be/ns/infrastructuur#Wegmonoliet"	""	""
"CLASS"	"InfrastructuurElement"	"Zitbank"	"{AE700A67-C0F2-462b-B9A1-9BD63850D99F}"	"Straatmeubilair"	""	""	""	"Zitbank"	"Een openbaar zitmeubel, op een duurzame manier verbonden met het aardoppervlak en gelegen in parken of langsheen de openbare weg."	"Bron definitie: GRB-skeletaanvulling detail: WSM3: Niet-verplaatsbare zitbank."	""	"false"	"http://data.vlaanderen.be/ns/infrastructuur#"	"Zitbank"	"http://www.w3.org/2000/01/rdf-schema#Class"	""	""	"http://data.vlaanderen.be/ns/infrastructuur#Straatmeubilair"	""	""
"CLASS"	"InfrastructuurElement"	"OpenbaarToiletVerzinkbaar"	"{84BD93DF-CDF2-4b0b-9519-7B82EF0D1CD3}"	"Straatmeubilair"	""	""	""	"Verzinkbaar openbaar toilet"	"Een verzinkbaar openbaar toilet dat alleen tussen bepaalde tijdstippen of tijdens uitgaansavonden en evenementen gebruikt kan worden."	""	""	"false"	"http://data.vlaanderen.be/ns/infrastructuur#"	"OpenbaarToiletVerzinkbaar"	"http://www.w3.org/2000/01/rdf-schema#Class"	""	""	"http://data.vlaanderen.be/ns/infrastructuur#Straatmeubilair"	""	""
"CLASS"	"InfrastructuurElement"	"OpenbaarToilet"	"{7B616A1C-0F0E-4328-B683-36F962471CC3}"	"Straatmeubilair"	""	""	""	"Openbaar toilet"	"Een publiek toegankelijk toilet."	""	""	"false"	"http://data.vlaanderen.be/ns/infrastructuur#"	"OpenbaarToilet"	"http://www.w3.org/2000/01/rdf-schema#Class"	""	""	"http://data.vlaanderen.be/ns/infrastructuur#Straatmeubilair"	""	""
"CLASS"	"InfrastructuurElement"	"OpenbareBrievenbus"	"{55234F19-8E80-4f07-B0EF-AC7B60A56806}"	"Straatmeubilair"	""	""	""	"Openbare brievenbus"	"Een openbare postbus ter verzameling van briefwisseling voor regelmatige verzending via postbedrijven."	"Bron definitie: GRB-skeletaanvulling detail: WPI13: Openbare brievenbus"	""	"false"	"http://data.vlaanderen.be/ns/infrastructuur#"	"OpenbareBrievenbus"	"http://www.w3.org/2000/01/rdf-schema#Class"	""	""	"http://data.vlaanderen.be/ns/infrastructuur#Straatmeubilair"	""	""
"CLASS"	"InfrastructuurElement"	"Betaalautomaat"	"{EF6EC13A-874D-4308-8088-D9E5F2E08544}"	"Straatmeubilair"	""	""	""	"Betaalautomaat"	"Automaat die betaalkaarten of geld accepteert om betalingen uit te voeren bijvoorbeeld voor parkeertickets of tickets voor het openbaar vervoer."	"Bron definitie: GRB-skeletaanvulling detail: WPI23: Parkeermeter en betaalautomaat."	""	"false"	"http://data.vlaanderen.be/ns/infrastructuur#"	"Betaalautomaat"	"http://www.w3.org/2000/01/rdf-schema#Class"	""	""	"http://data.vlaanderen.be/ns/infrastructuur#Straatmeubilair"	""	""
"CLASS"	"InfrastructuurElement"	"Picknicktafel"	"{A954B537-23E2-4f01-AA7D-AF759ED61D14}"	"Straatmeubilair"	""	""	""	"Picknicktafel"	"Een picknicktafel is een tafel met vaak daaraan gemonteerde zitbanken of stoelen die kan gebruikt worden om te picknicken. Vaak staan deze permanent opgesteld en voor iedereen vrij toegankelijk op verzorgingsplaatsen langs autowegen, in recreatiegebieden, in parken of op pleinen."	"Bron definitie: GRB-skeletoptie groen- en begraafplaatsenbeheer: PRA: Park- of recreatieattribuut + P: picknicktafel"	""	"false"	"http://data.vlaanderen.be/ns/infrastructuur#"	"Picknicktafel"	"http://www.w3.org/2000/01/rdf-schema#Class"	""	""	"http://data.vlaanderen.be/ns/infrastructuur#Straatmeubilair"	""	""
"CLASS"	"InfrastructuurElement"	"Reddingsboei"	"{B7D08681-32CE-48cc-A0EC-7607AB91F195}"	"Straatmeubilair"	""	""	""	"Reddingsboei"	"Een reddingsboei is een drijfhulpmiddel en reddingsmiddel voor personen die door omstandigheden te water zijn geraakt."	""	""	"false"	"http://data.vlaanderen.be/ns/infrastructuur#"	"Reddingsboei"	"http://www.w3.org/2000/01/rdf-schema#Class"	""	""	"http://data.vlaanderen.be/ns/infrastructuur#Straatmeubilair"	""	""
"CLASS"	"InfrastructuurElement"	"Rijbaankussen"	"{45A4A8AC-D2EC-4309-8F33-76CF4ADF4A09}"	"Straatmeubilair"	""	""	""	"Rijbaankussen"	"Een verkeersremmer vervaardigd uit kunststof en strekt zich doorgaans niet uit over de volledige breedte van de rijbaan."	""	""	"false"	"http://data.vlaanderen.be/ns/infrastructuur#"	"Rijbaankussen"	"http://www.w3.org/2000/01/rdf-schema#Class"	""	""	"http://data.vlaanderen.be/ns/infrastructuur#Straatmeubilair"	""	""
"CLASS"	"InfrastructuurElement"	"Sculptuur"	"{D0551BE0-C286-47c1-B3F4-34501E122843}"	"CultuurhistorischMonument"	""	""	""	"Sculptuur"	"Al dan niet vrijstaande, meestal driedimensionale kunstwerken."	"Voor een verdere specialisatie van dit object verwijzen we naar de erfgoedtypes thesaurus van Onroerend Erfgoed."	""	"true"	"https://id.erfgoed.net/thesauri/erfgoedtypes/48"	""	"http://www.w3.org/2000/01/rdf-schema#Class"	""	""	"http://data.vlaanderen.be/ns/infrastructuur#CultuurhistorischMonument"	""	""
"CLASS"	"InfrastructuurElement"	"Straatspiegel"	"{A3048705-85E9-473d-BF1A-DFA780A1F463}"	"Straatmeubilair"	""	""	""	"Straatspiegel"	"	(Meestal) bolvormig reflecterend voorwerp, specifiek geplaatst ten behoeve van verkeersveiligheid."	""	""	"false"	"http://data.vlaanderen.be/ns/infrastructuur#"	"Straatspiegel"	"http://www.w3.org/2000/01/rdf-schema#Class"	""	""	"http://data.vlaanderen.be/ns/infrastructuur#Straatmeubilair"	""	""
"CLASS"	"InfrastructuurElement"	"NormandischeAfsluiting"	"{234137F5-3528-44da-9241-0B30CD7C88EE}"	"BestendigeAfsluiting"	""	""	""	"Normandische afsluiting"	"Een afsluiting die typisch bestaat uit betonnen palen met betonnen dwarsbalken."	""	""	"false"	"http://data.vlaanderen.be/ns/infrastructuur#"	"NormandischeAfsluiting"	"http://www.w3.org/2000/01/rdf-schema#Class"	""	""	"http://data.vlaanderen.be/ns/infrastructuur#BestendigeAfsluiting"	""	""
"CLASS"	"InfrastructuurElement"	"Dwarsligger"	"{7F6BED8F-C29A-4b1f-8EDD-5F18AC3F4513}"	"BestendigeAfsluiting"	""	""	""	"Dwarsligger"	"Een afsluiting met één of meerdere horizontale dwarsliggers."	""	""	"false"	"http://data.vlaanderen.be/ns/infrastructuur#"	"Dwarsligger"	"http://www.w3.org/2000/01/rdf-schema#Class"	""	""	"http://data.vlaanderen.be/ns/infrastructuur#BestendigeAfsluiting"	""	""
"CLASS"	"InfrastructuurElement"	"Draadafsluiting"	"{21BCA416-0BCC-4487-B835-915FB5F4A1EC}"	"BestendigeAfsluiting"	""	""	""	"Draadafsluiting"	"TODO"	""	""	"false"	"http://data.vlaanderen.be/ns/infrastructuur#"	"Draadafsluiting"	"http://www.w3.org/2000/01/rdf-schema#Class"	""	""	"http://data.vlaanderen.be/ns/infrastructuur#BestendigeAfsluiting"	""	""
"CLASS"	"InfrastructuurElement"	"Treinbiels"	"{525C662E-BC33-4c90-B668-DD038F7CE783}"	"BestendigeAfsluiting"	""	""	""	"Treinbiels"	"TODO"	""	""	"false"	"http://data.vlaanderen.be/ns/infrastructuur#"	"Treinbiels"	"http://www.w3.org/2000/01/rdf-schema#Class"	""	""	"http://data.vlaanderen.be/ns/infrastructuur#BestendigeAfsluiting"	""	""
"CLASS"	"InfrastructuurElement"	"Stootband"	"{F594BFD7-52D5-4b11-A0A7-8C2C45F0B8CC}"	"BestendigeAfsluiting"	""	""	""	"Stootband"	"Vaste inrichtingselementen binnen de wegbaan (WBN) met als doel de normale verkeersstromen in gescheiden stroken te leiden. Deze zijn overwegend parallel aan de hartlijn van de wegbaan georiënteerd een stootband is een geprefabriceerde betonnen veiligheidsband die over haar gehele lengte op de bodem rust en geplaatst werd om te voorkomen dat voertuigen van de weg afraken."	"Bron object: GRB WLI2: Muur / stootband"	""	"false"	"http://data.vlaanderen.be/ns/infrastructuur#"	"Stootband"	"http://www.w3.org/2000/01/rdf-schema#Class"	""	""	"http://data.vlaanderen.be/ns/infrastructuur#BestendigeAfsluiting"	""	""
"CLASS"	"InfrastructuurElement"	"StootbandDupuis"	"{A02B5E90-08FA-4d66-8B01-59F4DC3C69CE}"	"Stootband"	""	""	""	"Stootband dupuis"	"Geprefabriceerde betonnen veiligheidsstootband die over haar gehele lengte op de bodem rust en geplaatst werd om te voorkomen dat voertuigen van de weg afgeraken. Deze zijn overwegend parallel aan de hartlijn van de wegbaan georiënteerd."	"Bron object: GRB WLI11: Stootband type dupuis "	""	"false"	"http://data.vlaanderen.be/ns/infrastructuur#"	"StootbandDupuis"	"http://www.w3.org/2000/01/rdf-schema#Class"	""	""	"http://data.vlaanderen.be/ns/infrastructuur#Stootband"	""	""
"CLASS"	"InfrastructuurElement"	"StootbandNewJersey"	"{526D3B99-9779-4a49-AD30-A623E36EC2E1}"	"Stootband"	""	""	""	"Stootband new jersey"	"Ter plaatse vervaardigde hoge (0,60 tot 1,00m) betonnen veiligheidsstootband die over haar gehele lengte op de bodem rust. Deze zijn overwegend parallel aan de hartlijn van de wegbaan georiënteerd."	"Bron object: GRB WLI12: Stootband type new jersey"	""	"false"	"http://data.vlaanderen.be/ns/infrastructuur#"	"StootbandNewJersey"	"http://www.w3.org/2000/01/rdf-schema#Class"	""	""	"http://data.vlaanderen.be/ns/infrastructuur#Stootband"	""	""
"CLASS"	"InfrastructuurElement"	"Veiligheidsband"	"{23301ED2-76E9-4740-85BB-F349DC9284EA}"	"Stootband"	""	""	""	"Veiligheidsband"	"Geprefabriceerde lage betonnen veiligheidsstootband die over haar gehele lengte op de bodem rust. Deze zijn overwegend parallel aan de hartlijn van de wegbaan georiënteerd."	"Bron object: GRB WLI13: Stootband type veiligheidsband"	""	"false"	"http://data.vlaanderen.be/ns/infrastructuur#"	"Veiligheidsband"	"http://www.w3.org/2000/01/rdf-schema#Class"	""	""	"http://data.vlaanderen.be/ns/infrastructuur#Stootband"	""	""
"CLASS"	"InfrastructuurElement"	"Geluidscherm"	"{B2A37D94-5271-4b8b-AD52-1AD106CF6DD5}"	"BestendigeAfsluiting"	""	""	""	"Geluidscherm"	"Geluidswerende wand langs autosnelwegen, spoorwegen, met als doel de omwonenden"	"Bron object: GRB WGS: geluidsscherm"	""	"false"	"http://data.vlaanderen.be/ns/infrastructuur#"	"Geluidscherm"	"http://www.w3.org/2000/01/rdf-schema#Class"	""	""	"http://data.vlaanderen.be/ns/infrastructuur#BestendigeAfsluiting"	""	""
"CLASS"	"InfrastructuurElement"	"Communicatiemast"	"{44941B5B-D12B-473a-9A7A-949F9529E9F7}"	"Mast"	""	""	""	"Communicatiemast"	"Een communicatiemast divers is een meervoudige metalen constructie zoals een tijdelijke GSM-mast, een mast van een radio-amateur, een private ontvangst- en zendinstallatie."	"Bron object: GRB KNW15: Communicatiemast divers"	""	"false"	"http://data.vlaanderen.be/ns/infrastructuur#"	"Communicatiemast"	"http://www.w3.org/2000/01/rdf-schema#Class"	""	""	"http://data.vlaanderen.be/ns/infrastructuur#Mast"	""	""
"CLASS"	"InfrastructuurElement"	"Bushok"	"{EFBA6364-C56A-438d-BB59-F6283EABB9F4}"	"Straatmeubilair"	""	""	""	"Bushok"	"Een bushok biedt in de regel onderdak aan reizigers van het openbaar vervoer."	"Bron object: GRB WGA1: Bushok"	""	"false"	"http://data.vlaanderen.be/ns/infrastructuur#"	"Bushok"	"http://www.w3.org/2000/01/rdf-schema#Class"	""	""	"http://data.vlaanderen.be/ns/infrastructuur#Straatmeubilair"	""	""
"CLASS"	"InfrastructuurElement"	"OpenbareVerlichting"	"{46F787F6-7050-4c12-9E57-869F4A8F8861}"	"Infrastructuurelement"	""	""	""	"Openbare verlichting"	"TODO"	""	""	"false"	"http://data.vlaanderen.be/ns/infrastructuur#"	"OpenbareVerlichting"	"http://www.w3.org/2000/01/rdf-schema#Class"	""	""	"http://data.vlaanderen.be/ns/infrastructuur#Infrastructuurelement"	""	""
"CLASS"	"InfrastructuurElement"	"OpenbareStraatverlichtingMuur"	"{FDEDC51E-D6D9-45f5-A752-713C504DDEEC}"	"OpenbareVerlichting"	""	""	""	"Openbare straatverlichting aan gevel of muur"	"Een openbaar lichtpunt dat is bevestigd aan de gevel van een gebouw of constructie of bevestigd is aan een muur en dat gebruikt wordt om de omgeving te verlichten."	"Omvat bijvoorbeeld ook de plafondverlichting in tunnels. Bron object: GRB WPI31: Openbare straatverlichting aan gevel/muur"	""	"false"	"http://data.vlaanderen.be/ns/infrastructuur#"	"OpenbareStraatverlichtingMuur"	"http://www.w3.org/2000/01/rdf-schema#Class"	""	""	"http://data.vlaanderen.be/ns/infrastructuur#OpenbareVerlichting"	""	""
"CLASS"	"InfrastructuurElement"	"Knipperlicht"	"{499A5FCA-E67A-405d-AB15-1003F4E0675D}"	"Wegsignalisatie"	""	""	""	"Knipperlicht"	"Den knipperlicht is een oranje, wit of rood knipperlicht op een paal, dat dienst doet als verkeerssignaal op wegen (vb. zone 30)."	"Bron object: GRB WPI33: Knipperlicht"	""	"false"	"http://data.vlaanderen.be/ns/infrastructuur#"	"Knipperlicht"	"http://www.w3.org/2000/01/rdf-schema#Class"	""	""	"http://data.vlaanderen.be/ns/infrastructuur#Wegsignalisatie"	""	""
"CLASS"	"InfrastructuurElement"	"Verkeerslicht"	"{3B4FA76C-26CC-4d75-ADCD-5C936FEFE798}"	"Wegsignalisatie"	""	""	""	"Verkeerslicht"	"TODO"	""	""	"false"	"http://data.vlaanderen.be/ns/infrastructuur#"	"Verkeerslicht"	"http://www.w3.org/2000/01/rdf-schema#Class"	""	""	"http://data.vlaanderen.be/ns/infrastructuur#Wegsignalisatie"	""	""
"CLASS"	"InfrastructuurElement"	"VerkeerslichtVoetgangerFietser"	"{A6913CA6-F04F-4697-A752-331C1E33242F}"	"Wegsignalisatie"	""	""	""	"Verkeerslicht voetganger fietser"	"TODO"	""	""	"false"	"http://data.vlaanderen.be/ns/infrastructuur#"	"VerkeerslichtVoetgangerFietser"	"http://www.w3.org/2000/01/rdf-schema#Class"	""	""	"http://data.vlaanderen.be/ns/infrastructuur#Wegsignalisatie"	""	""
"CLASS"	"InfrastructuurElement"	"Infozuil"	"{BB8FA565-7551-4ed0-866B-A592AC3824C1}"	"Straatmeubilair"	""	""	""	"Infozuil"	"TODO"	""	""	"false"	"http://data.vlaanderen.be/ns/infrastructuur#"	"Infozuil"	"http://www.w3.org/2000/01/rdf-schema#Class"	""	""	"http://data.vlaanderen.be/ns/infrastructuur#Straatmeubilair"	""	""
"CLASS"	"InfrastructuurElement"	"Verkeersbord"	"{63293FCA-CF77-4221-83CA-A4ACA5B21805}"	"Wegsignalisatie"	""	""	""	"Verkeersbord"	"TODO"	""	""	"false"	"http://data.vlaanderen.be/ns/infrastructuur#"	"Verkeersbord"	"http://www.w3.org/2000/01/rdf-schema#Class"	""	""	"http://data.vlaanderen.be/ns/infrastructuur#Wegsignalisatie"	""	""
"CLASS"	"InfrastructuurElement"	"Wegsignalisatie"	"{8DC8FDBC-4F97-4c3d-8789-1A46297EB331}"	"Signalisatie"	""	""	""	"Wegsignalisatie"	"Alle elementen aangebracht ten behoeve van de weggebruiker, bijvoorbeeld: reflectorpaaltjes, palen voor verkeersborden, wegwijzers, plaatsnaamborden, straatnaambord, bord bebouwde kom, signalisatiepalen openbaar vervoer."	""	""	"false"	"http://data.vlaanderen.be/ns/infrastructuur#"	"Wegsignalisatie"	"http://www.w3.org/2000/01/rdf-schema#Class"	""	""	"http://data.vlaanderen.be/ns/infrastructuur#Signalisatie"	""	""
"CLASS"	"InfrastructuurElement"	"Aanplakbord"	"{F63D0145-2C65-4a7f-84C5-06A9B80EC847}"	"Straatmeubilair"	""	""	""	"Aanplakbord"	"TODO"	""	""	"false"	"http://data.vlaanderen.be/ns/infrastructuur#"	"Aanplakbord"	"http://www.w3.org/2000/01/rdf-schema#Class"	""	""	"http://data.vlaanderen.be/ns/infrastructuur#Straatmeubilair"	""	""
"CLASS"	"InfrastructuurElement"	"SeininstallatieOvergangSpoorbedding"	"{3FBB243D-0E0A-478f-AB41-C5A3582E762E}"	"Wegsignalisatie"	""	""	""	"Seininstallatie overgang spoorbedding"	"TODO"	""	""	"false"	"http://data.vlaanderen.be/ns/infrastructuur#"	"SeininstallatieOvergangSpoorbedding"	"http://www.w3.org/2000/01/rdf-schema#Class"	""	""	"http://data.vlaanderen.be/ns/infrastructuur#Wegsignalisatie"	""	""
"CLASS"	"InfrastructuurElement"	"Recyclagecontainer"	"{914C66CF-E04B-4857-8B76-464C810F4CD3}"	"Infrastructuurelement"	""	""	""	"Recyclagecontainer"	"Container voor het verzamelen van al dan niet specifiek materiaal met als doel het te sorteren, recycleren of hergebruiken."	""	""	"false"	"http://data.vlaanderen.be/ns/infrastructuur#"	"Recyclagecontainer"	"http://www.w3.org/2000/01/rdf-schema#Class"	""	""	"http://data.vlaanderen.be/ns/infrastructuur#Infrastructuurelement"	""	""
"CLASS"	"InfrastructuurElement"	"Bladkorf"	"{FF0119F6-93E1-495e-BD11-26F47AC3B185}"	"Recyclagecontainer"	""	""	""	"Bladkorf"	"	Container of bak bedoeld voor het verzamelen van afgevallen bladeren"	""	""	"false"	"http://data.vlaanderen.be/ns/infrastructuur#"	"Bladkorf"	"http://www.w3.org/2000/01/rdf-schema#Class"	""	""	"http://data.vlaanderen.be/ns/infrastructuur#Recyclagecontainer"	""	""
"CLASS"	"InfrastructuurElement"	"Blikvanger"	"{E56D6CAE-8842-44a6-B3D6-4860D8464ACF}"	"Recyclagecontainer"	""	""	""	"Bak bedoeld voor het verzamelen van afval."	"Een type afvalbak veelal naast fietspaden of rijbanen, zodanig ontworpen dat weggebruikers hun afval erin kwijt zonder te hoeven vertragen."	""	""	"false"	"http://data.vlaanderen.be/ns/infrastructuur#"	"Blikvanger"	"http://www.w3.org/2000/01/rdf-schema#Class"	""	""	"http://data.vlaanderen.be/ns/infrastructuur#Recyclagecontainer"	""	""
"CLASS"	"InfrastructuurElement"	"Restafvalcontainer"	"{EF365E0D-9690-4049-9E2C-94FDF77CECC8}"	"Recyclagecontainer"	""	""	""	"Restafvalcontainer"	"Container bedoeld voor het verzamelen van resafval. "	"Een restafvalcontainer verschilt van een openbare vuilnisbak in het feit dat een afvalcontainer als inzamelpunt geldt voor bewust verzamelen van grotere hoeveelheden afval, terwijl een openbare vuilnisbak enkel dient voor het deponeren van zeer beperkte hoeveelheden van afval door toevallige voorbijgangers."	""	"false"	"http://data.vlaanderen.be/ns/infrastructuur#"	"Restafvalcontainer"	"http://www.w3.org/2000/01/rdf-schema#Class"	""	""	"http://data.vlaanderen.be/ns/infrastructuur#Recyclagecontainer"	""	""
"CLASS"	"InfrastructuurElement"	"Glascontainer"	"{3AFA79F4-8F6A-428f-86C5-096BEBA87AAF}"	"Recyclagecontainer"	""	""	""	"Container of bak bedoeld voor het verzamelen van glas."	"Glascontainer"	""	""	"false"	"http://data.vlaanderen.be/ns/infrastructuur#"	"Glascontainer"	"http://www.w3.org/2000/01/rdf-schema#Class"	""	""	"http://data.vlaanderen.be/ns/infrastructuur#Recyclagecontainer"	""	""
"CLASS"	"InfrastructuurElement"	"Kledingcontainer"	"{64D56AA5-2F16-4747-9CE5-DE47C023D9E0}"	"Recyclagecontainer"	""	""	""	"Kledingcontainer"	"Container of bak bedoeld voor het verzamelen van kleding."	""	""	"false"	"http://data.vlaanderen.be/ns/infrastructuur#"	"Kledingcontainer"	"http://www.w3.org/2000/01/rdf-schema#Class"	""	""	"http://data.vlaanderen.be/ns/infrastructuur#Recyclagecontainer"	""	""
"CLASS"	"InfrastructuurElement"	"Schoencontainer"	"{55D5F0B1-8CBB-4406-9DC0-01CFD75C6A0B}"	"Recyclagecontainer"	""	""	""	"Schoencontainer"	"Container of bak bedoeld voor het verzamelen van schoenen."	""	""	"false"	"http://data.vlaanderen.be/ns/infrastructuur#"	"Schoencontainer"	"http://www.w3.org/2000/01/rdf-schema#Class"	""	""	"http://data.vlaanderen.be/ns/infrastructuur#Recyclagecontainer"	""	""
"CLASS"	"InfrastructuurElement"	"OpenbareVuilnisbak"	"{29D762C5-5CA8-4dc1-8A18-4D9C9DDBB1F1}"	"Straatmeubilair"	""	""	""	"Openbare vuilnisbak"	"Deels in de grond ingewerkte of verankerde vuilnisbak, bestemd voor het deponeren van afval van de voorbijgangers en gelegen op het openbare domein."	"Bron definitie: GRB-skeletaanvulling detail: WPI15: Openbare vuilnisbak"	""	"false"	"http://data.vlaanderen.be/ns/infrastructuur#"	"OpenbareVuilnisbak"	"http://www.w3.org/2000/01/rdf-schema#Class"	""	""	"http://data.vlaanderen.be/ns/infrastructuur#Straatmeubilair"	""	""
"CLASS"	"InfrastructuurElement"	"OmklapbareWegmonoliet"	"{E0DADB03-DC66-4417-9368-A2B0AD669F76}"	"Wegmonoliet"	""	""	""	"Omklapbare wegmonoliet"	"Een omklapbaar massief obstakel dat de doorgang van voertuigen belet en niet dynamisch is in aard."	""	""	"false"	"http://data.vlaanderen.be/ns/infrastructuur#"	"OmklapbareWegmonoliet"	"http://www.w3.org/2000/01/rdf-schema#Class"	""	""	"http://data.vlaanderen.be/ns/infrastructuur#Wegmonoliet"	""	""
"CLASS"	"InfrastructuurElement"	"WegneembareWegmonoliet"	"{98C902F6-768A-47c7-91AB-1CA5246D852E}"	"Wegmonoliet"	""	""	""	"Wegneembare wegmonoliet"	"Een wegneembaar obstakel dat de doorgang van voertuigen belet en niet dynamisch is in aard."	""	""	"false"	"http://data.vlaanderen.be/ns/infrastructuur#"	"WegneembareWegmonoliet"	"http://www.w3.org/2000/01/rdf-schema#Class"	""	""	"http://data.vlaanderen.be/ns/infrastructuur#Wegmonoliet"	""	""
"CLASS"	"InfrastructuurElement"	"Wegmonoliet"	"{C3CF0693-00E4-4587-972B-F1B33C8A260E}"	"SelectieveAfsluiting"	""	""	""	"Wegmonoliet"	"Een massief obstakel dat de doorgang van voertuigen belet."	"Bron definitie: naar GRB-skeletaanvulling detail: WPI14: Wegmonoliet"	""	"false"	"http://data.vlaanderen.be/ns/infrastructuur#"	"Wegmonoliet"	"http://www.w3.org/2000/01/rdf-schema#Class"	""	""	"http://data.vlaanderen.be/ns/infrastructuur#SelectieveAfsluiting"	""	""
"CLASS"	"InfrastructuurElement"	"Keldergat"	"{28C1DAE5-F8CC-48c6-9737-F55F71864BCC}"	"Rooster"	""	""	""	"Keldergat"	"Elke horizontale en artificieel afgebakende opening in het maaiveld langsheen de gevelwand"	"Bron object: GRB GBA8  Rand gebouwaanhorigheid type keldergat"	""	"false"	"http://data.vlaanderen.be/ns/infrastructuur#"	"Keldergat"	"http://www.w3.org/2000/01/rdf-schema#Class"	""	""	"http://data.vlaanderen.be/ns/infrastructuur#Rooster"	""	""
"CLASS"	"InfrastructuurElement"	"Parkeersensor"	"{7493FD91-FCC6-4f66-B83E-4CE4568C7943}"	"Sensor"	""	""	""	"Parkeersensor"	"Een sensor in het wegdek die de aanwezigheid van een voertuig op een parkeerplaats registreert."	""	""	"false"	"http://data.vlaanderen.be/ns/infrastructuur#"	"Parkeersensor"	"http://www.w3.org/2000/01/rdf-schema#Class"	""	""	"http://data.vlaanderen.be/ns/infrastructuur#Sensor"	""	""
